{
  "$schema": "http://json-schema.org/draft-07/schema#",
  "title": "Free steel profile (source)",
  "description": "Woodcore-Datei/profiles/<id>.json -- one free steel profile drawn or typed in Woodcore's «Profilés» tab: rectangles, each with the role of its wall in the section class (issue #50, spec 2026-10-12-section-acier D-10, D-11, D-12; docs/domain/steel.md). Read and checked by calc/domains/profile.py (`check_source`), which computes its values; a position names it by the section type USR and the id as its dimension. Every length in mm.",
  "type": "object",
  "required": ["schema", "schema_version", "id", "parts"],
  "properties": {
    "schema": {"const": "profile-source"},
    "schema_version": {"type": "string", "enum": ["1.0"]},
    "id": {
      "type": "string",
      "pattern": "^[A-Za-z0-9][A-Za-z0-9_.+-]*$",
      "description": "The file's name; never an SZS C5 designation («HEA 200»), which a position's dimension would read as a catalogue profile."
    },
    "name": {"type": "string"},
    "label": {"type": "string"},
    "group": {"type": "string", "description": "The folder of the tab's left pane."},
    "unit": {"const": "mm"},
    "template": {
      "type": ["object", "null"],
      "description": "The model the profile was drawn from -- {kind: I | U | T | L | RHS | plate, params} or {c5: \"HEA 200\", kind, params} -- kept as provenance, never read back as a value."
    },
    "parts": {
      "type": "array",
      "minItems": 1,
      "items": {
        "type": "object",
        "required": ["name", "y", "z", "b", "h", "role"],
        "properties": {
          "name": {"type": "string", "minLength": 1},
          "y": {"type": "number", "description": "The lower left corner, to the right."},
          "z": {"type": "number", "description": "The lower left corner, upwards."},
          "b": {"type": "number", "exclusiveMinimum": 0, "description": "The width, along y."},
          "h": {"type": "number", "exclusiveMinimum": 0, "description": "The height, along z."},
          "role": {
            "type": "string",
            "enum": ["internal", "outstand", "none"],
            "description": "internal: a plate held on both long edges (Tabelle 5a); outstand: held on one (Tabelle 5b); none: a junction, not classified. domains/profile.py ROLES."
          }
        }
      }
    }
  }
}
